{
  "$schema": "https://json-schema.org/draft/2020-12/schema",
  "$id": "https://we-build.example/schemas/poa-attestation-credential.schema.json",
  "title": "EU Power of Attorney Attestation Credential",
  "description": "Example credential claim schema derived from docs/v1.0_eu_poa_attestation_descript.docx for use in iGrant EUDI issuance exercises.",
  "type": "object",
  "additionalProperties": false,
  "required": [
    "date_of_execution",
    "euid_reference",
    "principal_full_name",
    "principal_date_of_birth",
    "company_statutory_full_name",
    "company_business_register_name",
    "company_jurisdiction",
    "attorney_full_name",
    "scope_of_representation_powers",
    "validity_period_valid_from",
    "validity_period_valid_until",
    "applicable_law_jurisdiction",
    "signing_place",
    "signing_date"
  ],
  "properties": {
    "date_of_execution": {
      "type": "string",
      "format": "date",
      "description": "Date on which the power of attorney was executed. It should be equal to or earlier than validity_period_valid_from."
    },
    "euid_reference": {
      "type": "string",
      "description": "EUID reference for the company to which the power of attorney applies.",
      "pattern": "^[A-Z]{2}[A-Z0-9]+\\.[A-Za-z0-9.-]+$",
      "examples": [
        "FIHPR.1234567-8"
      ]
    },
    "principal_full_name": {
      "type": "string",
      "description": "Legal full name of the principal acting on behalf of the company.",
      "examples": [
        "Aino Korhonen"
      ]
    },
    "principal_date_of_birth": {
      "type": "string",
      "format": "date",
      "description": "Date of birth of the principal."
    },
    "principal_identification_document_kind": {
      "type": "string",
      "description": "Type of identification document presented by the principal.",
      "enum": [
        "passport",
        "national_id_card",
        "residence_permit",
        "driving_license"
      ]
    },
    "principal_identification_document_number": {
      "type": "string",
      "description": "Document number of the principal's identification document."
    },
    "principal_place_of_birth": {
      "type": "string",
      "description": "Place of birth of the principal.",
      "examples": [
        "Helsinki"
      ]
    },
    "principal_full_address": {
      "type": "string",
      "description": "Residential address of the principal.",
      "examples": [
        "Mannerheimintie 10, 00100 Helsinki, Finland"
      ]
    },
    "company_statutory_full_name": {
      "type": "string",
      "description": "Registered legal name of the company.",
      "examples": [
        "We Build Oy"
      ]
    },
    "company_business_register_name": {
      "type": "string",
      "description": "Name of the business register in which the company is registered.",
      "examples": [
        "Finnish Trade Register"
      ]
    },
    "company_business_register_location": {
      "type": "string",
      "description": "Location of the business register.",
      "examples": [
        "Helsinki"
      ]
    },
    "company_kind_of_legal_entity": {
      "type": "string",
      "description": "Legal form of the company.",
      "examples": [
        "Oy"
      ]
    },
    "company_jurisdiction": {
      "type": "string",
      "description": "Country of incorporation of the company, expressed as an ISO 3166-1 alpha-2 code.",
      "pattern": "^[A-Z]{2}$",
      "examples": [
        "FI"
      ]
    },
    "company_registered_office": {
      "type": "string",
      "description": "Registered office address of the company.",
      "examples": [
        "Aleksanterinkatu 12, 00170 Helsinki, Finland"
      ]
    },
    "attorney_full_name": {
      "type": "string",
      "description": "Legal full name of the attorney or delegate.",
      "examples": [
        "Mika Niemi"
      ]
    },
    "attorney_date_of_birth": {
      "type": "string",
      "format": "date",
      "description": "Date of birth of the attorney when available."
    },
    "attorney_identification_document_kind": {
      "type": "string",
      "description": "Type of identification document presented by the attorney.",
      "enum": [
        "passport",
        "national_id_card",
        "residence_permit",
        "driving_license"
      ]
    },
    "attorney_identification_document_number": {
      "type": "string",
      "description": "Document number of the attorney's identification document."
    },
    "attorney_place_of_birth": {
      "type": "string",
      "description": "Place of birth of the attorney.",
      "examples": [
        "Espoo"
      ]
    },
    "attorney_full_address": {
      "type": "string",
      "description": "Residential address of the attorney.",
      "examples": [
        "Puistokatu 5, 20100 Turku, Finland"
      ]
    },
    "scope_of_representation_powers": {
      "type": "array",
      "description": "Granted powers under the power of attorney. The documented standard values include company formation, statute changes, branch registration or closure, cross-border conversions, cross-border mergers, and cross-border divisions. When scope_of_representation_power_of_substitution is limited, this array should also include the relevant limitation details.",
      "minItems": 1,
      "items": {
        "type": "string"
      },
      "uniqueItems": true,
      "examples": [
        [
          "Registration and closure of branches of the Company",
          "All legal transactions regarding cross border mergers involving the Company"
        ]
      ]
    },
    "scope_of_representation_power_of_substitution": {
      "type": "string",
      "description": "Whether substitution is allowed for the granted powers.",
      "enum": [
        "allowed",
        "not_allowed",
        "limited"
      ]
    },
    "validity_period_valid_from": {
      "type": "string",
      "format": "date",
      "description": "Start date from which the power of attorney is valid."
    },
    "validity_period_valid_until": {
      "type": "string",
      "format": "date",
      "description": "End date until which the power of attorney is valid. It should be later than validity_period_valid_from."
    },
    "applicable_law_jurisdiction": {
      "type": "string",
      "description": "Member State law governing the power of attorney, expressed as an ISO 3166-1 alpha-2 code.",
      "pattern": "^[A-Z]{2}$",
      "examples": [
        "FI"
      ]
    },
    "signing_place": {
      "type": "string",
      "description": "Place where the power of attorney was signed.",
      "examples": [
        "Helsinki"
      ]
    },
    "signing_date": {
      "type": "string",
      "format": "date",
      "description": "Date on which the power of attorney was signed."
    }
  },
  "examples": [
    {
      "date_of_execution": "2026-04-10",
      "euid_reference": "FIHPR.1234567-8",
      "principal_full_name": "Aino Korhonen",
      "principal_date_of_birth": "1987-09-16",
      "principal_identification_document_kind": "passport",
      "principal_identification_document_number": "PA1234567",
      "principal_place_of_birth": "Helsinki",
      "principal_full_address": "Mannerheimintie 10, 00100 Helsinki, Finland",
      "company_statutory_full_name": "We Build Oy",
      "company_business_register_name": "Finnish Trade Register",
      "company_business_register_location": "Helsinki",
      "company_kind_of_legal_entity": "Oy",
      "company_jurisdiction": "FI",
      "company_registered_office": "Aleksanterinkatu 12, 00170 Helsinki, Finland",
      "attorney_full_name": "Mika Niemi",
      "attorney_date_of_birth": "1990-01-20",
      "attorney_identification_document_kind": "national_id_card",
      "attorney_identification_document_number": "ID998877",
      "attorney_place_of_birth": "Espoo",
      "attorney_full_address": "Puistokatu 5, 20100 Turku, Finland",
      "scope_of_representation_powers": [
        "Registration and closure of branches of the Company",
        "All legal transactions regarding cross border mergers involving the Company"
      ],
      "scope_of_representation_power_of_substitution": "allowed",
      "validity_period_valid_from": "2026-04-11",
      "validity_period_valid_until": "2027-04-10",
      "applicable_law_jurisdiction": "FI",
      "signing_place": "Helsinki",
      "signing_date": "2026-04-10"
    }
  ]
}