{
  "date_of_execution": "2026-04-18",
  "euid_reference": "FIHPR.2468135-7",
  "principal_full_name": "Tarja Tomaatti",
  "principal_date_of_birth": "1978-06-14",
  "principal_identification_document_kind": "passport",
  "principal_identification_document_number": "PTA123456",
  "principal_place_of_birth": "Tampere",
  "principal_full_address": "Tomaattikuja 7, 33100 Tampere, Finland",
  "company_statutory_full_name": "Teemun Tomaatit Oy",
  "company_business_register_name": "Finnish Trade Register",
  "company_business_register_location": "Helsinki",
  "company_kind_of_legal_entity": "Oy",
  "company_jurisdiction": "FI",
  "company_registered_office": "Tomaattikuja 7, 33100 Tampere, Finland",
  "attorney_full_name": "Teemu Testi",
  "attorney_date_of_birth": "1991-04-12",
  "attorney_identification_document_kind": "national_id_card",
  "attorney_identification_document_number": "ID-TT-2026-001",
  "attorney_place_of_birth": "Tampere",
  "attorney_full_address": "Testikatu 3 A 4, 33100 Tampere, Finland",
  "scope_of_representation_powers": [
    "Request and receive VAT attestation on behalf of the Company",
    "Represent the Company in digital credential issuance procedures"
  ],
  "scope_of_representation_power_of_substitution": "not_allowed",
  "validity_period_valid_from": "2026-04-18",
  "validity_period_valid_until": "2027-04-18",
  "applicable_law_jurisdiction": "FI",
  "signing_place": "Tampere",
  "signing_date": "2026-04-18"
}